PROJECT NO,PROJECT NAME,WORK CODE,1,2,3,4,5,6,7,8,9,10,11,12,13,14,15,16,17,18,19,20,21,22,23,24,25,26,27,28,29,30,31,TOTAL,DESCRIPTION / COMMENTS
1220,Mosaic 6600 Cambie,DP,0.0,0.0,0.0,0.0,0.0,0.0,0.0,0.0,0.0,0.0,0.0,0.0,0.0,0.0,0.0,0.0,0.0,0.0,0.0,0.0,0.0,0.0,0.0,0.0,0.0,0.0,0.0,0.0,0.0,0.0,0.0,0.0,"Building Design, Autocad Drafting, Design Adjustments"
0515,Port Royal Highrise,WD,0.0,0.0,0.0,0.0,0.0,0.0,0.0,0.0,0.0,0.0,0.0,0.0,0.0,0.0,0.0,0.0,0.0,0.0,0.0,0.0,0.0,0.0,0.0,0.0,0.0,0.0,0.0,0.0,0.0,0.0,0.0,0.0,"Autocad line drawing, Construction Drawings, Details"
0515,Port Royal Highrise,EXT,0.0,0.0,0.0,0.0,0.0,0.0,0.0,0.0,0.0,0.0,0.0,0.0,0.0,0.0,0.0,0.0,0.0,0.0,0.0,0.0,0.0,0.0,0.0,0.0,0.0,0.0,0.0,0.0,0.0,0.0,0.0,0.0,"Revised Window Pattern, Suite Changes"
1405,UBC,DP,0.0,0.0,0.0,0.0,9.0,8.0,8.0,0.0,0.0,0.0,0.0,0.0,0.0,0.0,10.5,8.0,0.0,0.0,5.5,9.0,11.5,6.0,12.0,2.0,1.0,6.0,7.5,9.0,7.5,8.5,0.0,129.0,"Conceptual Design, Building Design, Autocad line drawing"
1109,Port Royal 6 Apts,DP,0.0,0.0,0.0,0.0,0.0,0.0,0.0,8.0,8.0,0.0,0.0,9.0,9.5,7.5,0.0,0.0,0.0,0.0,0.0,0.0,0.0,0.0,0.0,0.0,0.0,0.0,0.0,0.0,0.0,0.0,0.0,42.0,"Building Design, Autocad Drafting, Design Adjustments"
1313,King Edward,DP,0.0,0.0,0.0,0.0,0.0,0.0,0.0,0.0,0.0,0.0,0.0,0.0,0.0,0.0,0.0,0.0,0.0,0.0,0.0,0.0,0.0,0.0,0.0,0.0,0.0,0.0,0.0,0.0,0.0,0.0,0.0,0.0,Rendering
